chapter,chapter_index,section,section_index,text,first_jpg_url,pdf_url
CHAPTER 15.0,16,Skc. 11.,11,"Skc. 11 Every person owning property is required to list, and shall make out, sign and deliver to the list-taker a statement, verified by his or her oath, of all the real and personal property, moneys, credits, investments in bonds, stocks, joint stock com- panies, annuities, or otherwise, and the value of improvements on real estate since the same was assessed, in his or her possession, or under his or her control on the first day of June, either as owner or holder thereof, or as parent, guardian, trustee, execu- tor, executrix, administrator, administratrix, receiver, accounting officer, partner, agent, factor, or otherwise: Provided, that when- ever personal property,has been conveyed in trust, and the trustee resides outside of the state, but the trustor resides within the state, then and in that case such property shall be listed for taxation in this state.by such trustor where the property is situate. In all eases where a guardian, executor or executrix, administrator, or administratrix, resides in a city or incorporated town, all personal property in the hands of such guardian, executor or executrix, administrator or administratrix, shall be listed for taxation only where their wards resided on the first day of June, and where the deceased persons resided at the date of their death, unless such wards or deceased persons were non-residents of the state on the first day of June or at the day of death, in which ease the guardian, executor or executrix, administrator or ad ministratrix, shall list the said property where he or she resides on the first day of June: Provided, the guardian shall be exempt from municipal taxation on the personal property of his or her ward when the ward resides outside. the corporate limits of the city or town; Provided, that any one who, to evade the payment of #NAME? taxes surrenders or exchanges his or her certificates of de- posit in any bank in this state or elsewhere for non-taxpaying se- curities, and after the date of listing property has passed takes said certificates back and gives up such non-taxpaying securities shall be guilty of a misdemeanor.",https://archive.org/download/publiclawsresolu1899nort/publiclawsresolu1899nort_jp2.zip/publiclawsresolu1899nort_jp2%2Fpubliclawsresolu1899nort_0136.jp2&ext=jpg,https://archive.org/download/publiclawsresolu1899nort/publiclawsresolu1899nort.pdf#page=0136
CHAPTER 15.0,16,Sec. 12.,12,"Sec. 12 The list shall be given by the person charged, or his or her agent, during the month of June as herein prescribed: Provided, that agents for the purpose of listing property shall be appointed only by females or non-residents of the township where the property is situated, or by persons physically unable to at- tend and file their lists at any time during the month of June. The property of a corporation shall be given in by the president, eashier, treasurer or other person appointed for that purpose: Provided, that the cashier of every bank in North Carolina shall furnish to the board of county commissioners of each county wherein any of the stockholders reside the number of shares and market value of such shares held by each stockholder, and also furnish to the treasurer of the state the names and residences of all holders of said stock, and the auditor shall furnish tothe sheriff or other tax collector of each county the names and resi- denees of said stockholders.",https://archive.org/download/publiclawsresolu1899nort/publiclawsresolu1899nort_jp2.zip/publiclawsresolu1899nort_jp2%2Fpubliclawsresolu1899nort_0137.jp2&ext=jpg,https://archive.org/download/publiclawsresolu1899nort/publiclawsresolu1899nort.pdf#page=0137
CHAPTER 15.0,16,Sec. 13.,13,"Sec. 13 All real property and all stock, farming utensils and other personal property used in connection with the cultivation of a farm subject to taxation shall be listed in the township in which said property is situated on the first day of June. Stock which shall be grazing in a county other than that in which the owner resides shall be listed in the county in which the owner resides on the first day of June. When the fee of the soil of any tract, parcel or lot of land is in any person or persons natural or artificial, and the right to any minerals, quarry or timber therein is in another or others, the same shall be valued and listed agree- ably to such ownership in separate entries specifying in the inter- est listed, and shall be taxed to the parties owning the different interests respectively. In listing mineral, quarry, or timber or interests the owner thereof shall describe in his list, together with the separate value of the same on each separate tract or parcel of land in or on which the same shall be situated or lo- cated, and the list-taker shall be particular to enter the same on the tax list according to the returns. An owner of separate tim- ber interests shall list the same whether the timber shall be at- tached to or detached from the soil.",https://archive.org/download/publiclawsresolu1899nort/publiclawsresolu1899nort_jp2.zip/publiclawsresolu1899nort_jp2%2Fpubliclawsresolu1899nort_0137.jp2&ext=jpg,https://archive.org/download/publiclawsresolu1899nort/publiclawsresolu1899nort.pdf#page=0137
CHAPTER 15.0,16,Sec. 14.,14,"Sec. 14 All taxable polls and all personal property, except such shares of capital stock and other property as are directed to be listed otherwise in this act, shall be listed in the township in which the person so charged resides on the first day of June. The residence of a corporation, partnership or joint stock associa- tion, for the purposes of this act shall be deemed to be in town- ship in which its principal office or place of business is situated. If however the corporation, partnership or association have sepa- rate places of business in more than one township it shall give in each township the property or effects therein. Persons owning shares in incorporated companies, taxable by law, are not required to deliver to the list-taker a list thereof, but the president or or the chief officer of such corporation shall deliver to the list- taker a list of all shares of stock held therein and the value thereof except banks. The tax assessed on shares of stock em- braced in said list shall be paid by the corporations respectively. The shares in any branch bank shall be returned and the taxes thereon paid in the counties where such branches are located, and the president or other chief officer of such corporations, ex- cept banks, shall furnish to the auditor of the state the names and residences of all persons owning shares in said corporations, and the auditor shall furnish to the sheriff or tax collector of each county the names and residences of such persons owning shares in said corporations: Provided, that section fourteen can not be construed so as to impose a double tax on said corpora- tions.",https://archive.org/download/publiclawsresolu1899nort/publiclawsresolu1899nort_jp2.zip/publiclawsresolu1899nort_jp2%2Fpubliclawsresolu1899nort_0138.jp2&ext=jpg,https://archive.org/download/publiclawsresolu1899nort/publiclawsresolu1899nort.pdf#page=0138
CHAPTER 15.0,16,Sc. 15.,15,"Sc. 15 At the time and place appointed by the list-taker the taxpayer in person, except as provided in section twelve, shall attend and file with the list-taker on a blank to be prepared and furnished by the state treasurer a verified statement of all the property of every kind and description owned by the taxpayer. The taxpayer shall also swear to the TRUE value of his or her property and choses in action, except land, which oath shall be in the following form. to-wit: elisa pat at , dosolemnly swear (or affirm) that the list furnished by me contains a TRUE and accurate list of all property which by law I am required to list for taxation, and the value fixed thereon by me is a true_valuation of the same, and the amount of solvent credits given in by me is the full and correct amount of same ac- cording to my best knowledge, information, and belief. So help me, God. Any person making a FALSE return shall be deemed guilty of perjury. Property held in trust, or as agent, guardian, executor or executrix, administrator or administratrix, or in the right of a feme covert, shall be returned on a separate list. The sheriff or other tax collector in any county shall be liable to suit on his official bond for failure to report any FALSE return of property mentioned in this section which he may discover, or which may be otherwise discovered and made known to him, and it shall be his duty to report such fraud to the grand jury of his county: That any person, corporation or firm who fails to list the poil taxes and property taxes required of them by law shall be guilty of a misdemeanor.",https://archive.org/download/publiclawsresolu1899nort/publiclawsresolu1899nort_jp2.zip/publiclawsresolu1899nort_jp2%2Fpubliclawsresolu1899nort_0138.jp2&ext=jpg,https://archive.org/download/publiclawsresolu1899nort/publiclawsresolu1899nort.pdf#page=0138
CHAPTER 15.0,16,Src. 16.,16,"Src. 16 The list-taker shall state all the property of the person giving in, and also the age of the party, if a male with reference to his liability to a poll tax, and shall refer to the first day of June in that year. -1 the quantity of land owned in the town- ship, and the land shall be described by name, if it has one, otherwise in such a way that it may be identified. -2 The num- ber of horses, mules, jacks and jennies in one column, goats, cat- tle, hogs and sheep, separately with the TRUE value thereof. -8 Farming utensils, tools of mechanics, household and kitchen fur- niture, provisions, firearms, libraries and scientific instruments, specifying the articles separately at the TRUE value thereof. -4 Money on hand, including all: funds. invested within thirty days before in United States bonds or in other non-taxable property whatever. -5 The amount of credits, including accrued interest uncollected owing to the party, whether in or out of the state, whether owing by mortgage, bond, note, bill of exchange, certifi- eate, check, open account, or due and payable, whether owing by any state or government, county, city, town or township, in- dividua!, company or corporation. -6 All foreign building and loan associations doing business in this state by their secretary or treas- urer [shall] list for taxation its stock held by citizens of this state in the county, city or town where the owners of said stock reside. That in listing said stock for taxation the withdrawal value as fixed by the by-laws of each company, shall be furnished the list- taker, and the stock shal! be valued for taxation as other mon- eyed investments of citizens of this state. That any association or officer of said association doing business in this state who shall fail or refuse to so list shares of stock owned by citizens of this state for taxation shall be barred from doing business in this state; and any local officer or person who shall collect dues, as- sessments premiums, fines or interests from any citizen of this state for any such association which has failed or refused to list for taxation the stock held by citizens of this state shall be guilty of a misdemeanor and subject to fine and imprisonment, or both in the discretion of the court. That all of said taxes shall be paid by the association listing said stock. -7 Any certificate of deposit in any bank; whether in or out of the state, and the value of cot- ton, tobacco or other property in the hands of commission mer- chants or agents in or out of the state shall be deemed credits within the meaning of this act. If any credit be not regarded as entirely solvent it shall be given in at its current or market value. The party may deduct from the amount of his credits owing to him the amount of collectible debts owing by him as principal debtor. -8 Money investments, stocks and bonds of whatever na- ture, except bonds of this state and the United States and such other bonds as may have been expressly exempted from taxation by the law of this state, and such shares of stock in incorporated companies as may have been listed by the corporation. -9 All other personal property whatever, including therein all cotton in seed or lint, tobacco either in leaf or manufacture, turpentine, rosin, tar, brandy, whiskey, musical instruments, bicycles, goods, wares and merchandise of all kinds, plated and silverware and the watches and jewelry possessed by the party, or any minor or child, at their value. -10 The gross income of the party the twelve months next preceding the first day of June in the current year derived from property not already taxed by the laws of this state, with a statement of the source or sources from which it was derived, and also his income over one thousand dollars, derived from salaries or fees, or both. -11 If the party be a non-resident of the county and owns land therein, the list shall state his or her address, and may name any agent in the county to whom notice may be given respecting his or her taxes. -12 If any per- son shall, with a view to evade the payment of taxes, fail or re- fuse to give in to the assessor any bonds, notes, claims or other evidences of debt which are subject to assessment and taxation, under this act, the same shall not be recoverable by action at law or suit in equity before any of the courts of this state until they have been listed and the tax paid thereon.",https://archive.org/download/publiclawsresolu1899nort/publiclawsresolu1899nort_jp2.zip/publiclawsresolu1899nort_jp2%2Fpubliclawsresolu1899nort_0139.jp2&ext=jpg,https://archive.org/download/publiclawsresolu1899nort/publiclawsresolu1899nort.pdf#page=0139
CHAPTER 15.0,16,Src. 17.,17,"Src. 17 The list-takers shall be particular to examine each person on oath as to whether he or she has. other property than that stated in his or her return which he or she may claim is not liable to taxation. Such property, except bonds of the United States, and of this state, shall be entered and noted on the tax list, and if the board of commissioners shall be unable to decide the legal questionZinvolved, it shall be their duty to consult the state treasurer about the matter and to be governed by his decis- ion; and it shall be the duty of the state treasurer to decide all questions presented to him which may arise in the execution of this act, or the act to raise revenue. Every list-taker who shall fail to examine each person listing his or her property as required in this section shall be guilty of a misdemeanor and fined and imprisoned at the discretion of the court.",https://archive.org/download/publiclawsresolu1899nort/publiclawsresolu1899nort_jp2.zip/publiclawsresolu1899nort_jp2%2Fpubliclawsresolu1899nort_0140.jp2&ext=jpg,https://archive.org/download/publiclawsresolu1899nort/publiclawsresolu1899nort.pdf#page=0140
CHAPTER 15.0,16,Sxc. 18.,18,"Sxc. 18 If any person liable to be charged with taxes shall re- fuse to answer any questions respecting his or her property, or shall refuse to fill, sign and swear to his or her returns, he or she shall be guilty of a misdemeanor, and on conviction liable to be punished by a fine not exceeding fifty dollars, or imprisoned not exceeding thirty days, or both, and it shall be the duty of the list-taker to have the offender prosecuted. Every list-taker and chairman of the board of county commissioners shall have power to send for persons and papers, and to examine witnesses and ad- minister oaths.",https://archive.org/download/publiclawsresolu1899nort/publiclawsresolu1899nort_jp2.zip/publiclawsresolu1899nort_jp2%2Fpubliclawsresolu1899nort_0141.jp2&ext=jpg,https://archive.org/download/publiclawsresolu1899nort/publiclawsresolu1899nort.pdf#page=0141
CHAPTER 15.0,16,Sc. 19.,19,"Sc. 19 Each list-taker shall correct any parcel of real prop- erty on which any structure of over one hundred dollars value may have been erected, or on which any structure of the like value shall have been destroyed, agreeably to the returns made in accordance with the provisions of this act.",https://archive.org/download/publiclawsresolu1899nort/publiclawsresolu1899nort_jp2.zip/publiclawsresolu1899nort_jp2%2Fpubliclawsresolu1899nort_0141.jp2&ext=jpg,https://archive.org/download/publiclawsresolu1899nort/publiclawsresolu1899nort.pdf#page=0141
CHAPTER 15.0,16,SEc. 20.,20,"SEc. 20 The property mentioned in this section shall be ex- empt from taxation, to-wit: -1 That belonging to the United States or this state, or to any county or incorporated town, and used for public purposes. -2 The property belonging to and set apart and excusively used for the university, colleges, institutions of learning, academies, the Masonic fraternity, Order of Odd Fel- lows, Knights of Pythias, Independent Order of Mechanics, Good Templars, and Friends of Temperance, Knights of Honor, Good Samaritans and Brothers and Sisters of Love and Charity, Royal Arcanum, Hibernian Benevolent Society of Wilmington, the Israel and Priscilla Tent of Wilmington, Farmers Mutual Fire Insurance Association, schools for the education of the youth or support of the poor and afflicted, orphan asylums, such prop- erty as may be set apart for and appropriated to the exercise of divine worship, or the propagation of the gospel, or use as par- sonages, the same being the property of any religious denomina- tion or society: Provided, that all property not used exclusively for religious, charitable or educational purposes, or which is held for the purpose of speculating in the sale thereof, investment or for rent, shall not be exempt: Provided further, that when the rental from such property is applied exclusively to the support of the gospel, religious, charitable or school purposes, the prop- erty shall not be taxed. -3 Such property as may be set apart for graveyards or burial lots, except such as is held for the pur- pose of speculating in the sale thereof. -4 Twenty-five dollars of personal property of each individual taxpayer.",https://archive.org/download/publiclawsresolu1899nort/publiclawsresolu1899nort_jp2.zip/publiclawsresolu1899nort_jp2%2Fpubliclawsresolu1899nort_0141.jp2&ext=jpg,https://archive.org/download/publiclawsresolu1899nort/publiclawsresolu1899nort.pdf#page=0141
CHAPTER 15.0,16,SEc. 21.,21,"SEc. 21 The auditor of the state shall prepare forms to be used in assessing and listing property for taxation by the assessors and list-takers. He shall transmit said forms to the clerk of the board of commissioners of each county by the fifteenth day of May, and the clerk shall deliver to each board of list-takers and assessors the necessary number of the forms for their respective use. The assessors forms shall be furnished every fourth year and the list-takers forms annually.",https://archive.org/download/publiclawsresolu1899nort/publiclawsresolu1899nort_jp2.zip/publiclawsresolu1899nort_jp2%2Fpubliclawsresolu1899nort_0141.jp2&ext=jpg,https://archive.org/download/publiclawsresolu1899nort/publiclawsresolu1899nort.pdf#page=0141
CHAPTER 15.0,16,SEC. 22.,22,"SEC. 22 The list-takers shall on or before the first Monday in July in each year, return the tax list to the clerk of the board of commissioners. He shall also return a list of the property in the township not given in for taxation, with a description and valu- ation thereof made by himself, and the names of the occupant and supposed owner, and a list of the taxable polls of the town- ship not given in for taxation. The returns so made shall be open to the inspection of all persons interested, and the clerk shall give to any person desiring it a copy of so much thereof as re- lates to his property on paying a fee of ten cents.",https://archive.org/download/publiclawsresolu1899nort/publiclawsresolu1899nort_jp2.zip/publiclawsresolu1899nort_jp2%2Fpubliclawsresolu1899nort_0142.jp2&ext=jpg,https://archive.org/download/publiclawsresolu1899nort/publiclawsresolu1899nort.pdf#page=0142
CHAPTER 15.0,16,Sec. 23.,23,"Sec. 23 The list-taker upon making return to the board of com- missioners of the list and statements, shall take and subscribe an oath to the effect following, which may be administered by the chairman of the board of commissioners or any other officer au- thorized to administer oaths: T, _.______, list-taker of -_..___- in county of ________ , do sol- emnly swear (or affirm) the value of all real and personal prcp- erty, moneys, credits, investments in bonds, stocks, joint stock companies or otherwise, of which a statement has been made to me by the persons required by law to list the same, is truly re- turned as set forth in such statement; that in every case where by law I have been required by law to ascertain the items and value of the real and personal property, moneys, credits, invest- ments in bonds, stocks, joint stock companies or otherwise of any person, company or corporation, I have diligently and by the best means in my power endeavored to ascertain the real value thereof, and that I verily believe a full list with the value thereof estimated by the rules prescribed by law is set forth in the an- nexed returns; that in no case have I knowingly omitted to re- ceive of any person, of whom by law I was required to receive, a statement of the description and value of real and personal prop- erty or of the amount of moneys,.credits, investments in bonds, stocks, joint stock companies or otherwise which he was required to list, or in any way connived at any violation or evasion of any of the requirements prescribed by law in relation to the listing or valuation of property, moneys, credits, investments in bonds, stocks, joint stock companies or otherwise of any kind for taxa- tion, and that I have returned to the board of commissioners the original returns made to me, of which I have made, or which by law I am required to procure and return. Any list-taker making a FALSE return as aforesaid shall be deemed guilty of perjury.",https://archive.org/download/publiclawsresolu1899nort/publiclawsresolu1899nort_jp2.zip/publiclawsresolu1899nort_jp2%2Fpubliclawsresolu1899nort_0142.jp2&ext=jpg,https://archive.org/download/publiclawsresolu1899nort/publiclawsresolu1899nort.pdf#page=0142
CHAPTER 15.0,16,Src. 24.,24,"Src. 24 The board of commissioners of each county, after no- tice in one newspaper or by posters put up, shall meet on the sec ond Monday in July and revise the tax list and valuation reported to them and cause the register of deeds to complete ithe list by computing the tax payable by each person and affixing the same opposite his name. They shall sit for one day at least and when necessary shall sit until the revision is complete and shall hear all persons objecting to the valuation of their property or to the amount of tax charged against them. They shall have power to summon and examine witnesses, and shall correct the lists of the list-takers as may be right and just and so that the valuation of similar property throughout the county shall be as near uni- form as possible. They shall have power after notifying the owner or agent to raise the valuation of such property as they shall deem unreasonably low. The said board of commissioners on tendering the prescribed oath may take the list of any person applying to list his or her taxables at any meeting of the commis- sioners held on or before the second Monday in July, upon his or her paying the clerk twenty five cents for recording the same. The board of commissioners shall ascertain the valuation of his or her property by the examination of witnesses, or otherwise, and insert it in the abstract and without satisfactory excuse they may add to the tax of the person so allowed to give in five per eentum on the regular amount of his or her tax for that year. *",https://archive.org/download/publiclawsresolu1899nort/publiclawsresolu1899nort_jp2.zip/publiclawsresolu1899nort_jp2%2Fpubliclawsresolu1899nort_0143.jp2&ext=jpg,https://archive.org/download/publiclawsresolu1899nort/publiclawsresolu1899nort.pdf#page=0143
CHAPTER 15.0,16,Sc. 25.,25,"Sc. 25 If any person shall complain before the board of com- missioners that his or her property either real or personal has been improperly valued, or that he or she is charged with an excessive tax, he orshe shall present his or her claim in writing,and they shall hear any evidence adduced by him or her, and shall summon and examine any witnesses necessary for a just decision of the question, including the assessors or list-takers who made the valuation. If the board of commissioners shall find that he or she has cause for complaint they shall direct the clerk to render a TRUE account thereof, and the account thus rendered, certified by the clerk, shall be transmitted to the auditor who shall credit the sheriff with the overcharge in his settlement for the year.",https://archive.org/download/publiclawsresolu1899nort/publiclawsresolu1899nort_jp2.zip/publiclawsresolu1899nort_jp2%2Fpubliclawsresolu1899nort_0143.jp2&ext=jpg,https://archive.org/download/publiclawsresolu1899nort/publiclawsresolu1899nort.pdf#page=0143
