chapter,chapter_index,section,section_index,text,first_jpg_url,pdf_url
CHAPTER 7.0,8,Chapter_Title,1,CHAPTER 7 An act in regard to the pay of the clerks and other employees of the gone eral assembly. hes hey) The General Assembly of North Carolina do enact :,https://archive.org/download/publiclawsresolu1899nort/publiclawsresolu1899nort_jp2.zip/publiclawsresolu1899nort_jp2%2Fpubliclawsresolu1899nort_0102.jp2&ext=jpg,https://archive.org/download/publiclawsresolu1899nort/publiclawsresolu1899nort.pdf#page=0102
CHAPTER 7.0,8,SEcTIon 1.,2,SEcTIon 1 That section twenty-eight hundred and soventa two of The Code be amended by striking out the word fiye in. line three and inserting in lieu thereof the word four.,https://archive.org/download/publiclawsresolu1899nort/publiclawsresolu1899nort_jp2.zip/publiclawsresolu1899nort_jp2%2Fpubliclawsresolu1899nort_0102.jp2&ext=jpg,https://archive.org/download/publiclawsresolu1899nort/publiclawsresolu1899nort.pdf#page=0102
CHAPTER 7.0,8,Skc. 2.,3,Skc. 2 That all acts or sections of acts in contlies with this act are hereby repealed. j,https://archive.org/download/publiclawsresolu1899nort/publiclawsresolu1899nort_jp2.zip/publiclawsresolu1899nort_jp2%2Fpubliclawsresolu1899nort_0102.jp2&ext=jpg,https://archive.org/download/publiclawsresolu1899nort/publiclawsresolu1899nort.pdf#page=0102
CHAPTER 7.0,8,SEc. 3.,4,"SEc. 3 This act shall take effect and be in force from and after its ratification. , Ratified this twelfth day of January, A. D. eighteen hundred and ninety nine.",https://archive.org/download/publiclawsresolu1899nort/publiclawsresolu1899nort_jp2.zip/publiclawsresolu1899nort_jp2%2Fpubliclawsresolu1899nort_0102.jp2&ext=jpg,https://archive.org/download/publiclawsresolu1899nort/publiclawsresolu1899nort.pdf#page=0102
CHAPTER 8.0,9,Chapter_Title,1,"CHAPTER 6&8. An act to repeal chapter two hundred and three, public laws eighteen hundred and ninety-seven, entitled An act regulating the procuring) and distribution ot dead bodies for the promotion of medical science., The General Assembly of North Carolina do enact :",https://archive.org/download/publiclawsresolu1899nort/publiclawsresolu1899nort_jp2.zip/publiclawsresolu1899nort_jp2%2Fpubliclawsresolu1899nort_0102.jp2&ext=jpg,https://archive.org/download/publiclawsresolu1899nort/publiclawsresolu1899nort.pdf#page=0102
CHAPTER 8.0,9,Szcrion 1.,2,Szcrion 1 That chapter two hundred and three -203 of the. public laws of eighteen hundred and ninety-seven entitled An act regulating the procuring and distribution of dead. bodies for the promotion of medical science be and the same is hereby re- pealed. - Aye,https://archive.org/download/publiclawsresolu1899nort/publiclawsresolu1899nort_jp2.zip/publiclawsresolu1899nort_jp2%2Fpubliclawsresolu1899nort_0102.jp2&ext=jpg,https://archive.org/download/publiclawsresolu1899nort/publiclawsresolu1899nort.pdf#page=0102
CHAPTER 8.0,9,Sxc. 2.,3,"Sxc. 2 That this act shall be in force from and after its ratifi- | cation. Ratified this fourteenth day of January, A. D. eighteen hun- dred and ninety-nine. i",https://archive.org/download/publiclawsresolu1899nort/publiclawsresolu1899nort_jp2.zip/publiclawsresolu1899nort_jp2%2Fpubliclawsresolu1899nort_0102.jp2&ext=jpg,https://archive.org/download/publiclawsresolu1899nort/publiclawsresolu1899nort.pdf#page=0102
CHAPTER 9.0,10,Chapter_Title,1,CHAPTER 9 An act for the appointment of commissioners of navigation for Old Top- sail inlet [and] Beaufort harbor. The General Assembly of North Carolina do enact:,https://archive.org/download/publiclawsresolu1899nort/publiclawsresolu1899nort_jp2.zip/publiclawsresolu1899nort_jp2%2Fpubliclawsresolu1899nort_0103.jp2&ext=jpg,https://archive.org/download/publiclawsresolu1899nort/publiclawsresolu1899nort.pdf#page=0103
CHAPTER 9.0,10,Section 1.,2,"Section 1 The commissioners of navigation for Old Topsail in- let and Beaufort harbor shall be composed of three persons, to be elected as follows: The board of commissioners of Carteret county shall elect one, the commissioners of the town of Beau- fort shall elect one,and the commissioners of the town of More- head city shall elect one.",https://archive.org/download/publiclawsresolu1899nort/publiclawsresolu1899nort_jp2.zip/publiclawsresolu1899nort_jp2%2Fpubliclawsresolu1899nort_0103.jp2&ext=jpg,https://archive.org/download/publiclawsresolu1899nort/publiclawsresolu1899nort.pdf#page=0103
CHAPTER 9.0,10,See. 2.,3,"See. 2 The commissioners of navigation provided for in section one of this act shall be elected as therein directed, in June, eigh- teen hundred and ninety-nine, and every two years thereafter, and shall qualify by taking the oath required by law, before the elerk of the superior court or some justice of the peace of Car- teret county. and enter upon the discharge of their duties on the first Monday in July following their election.",https://archive.org/download/publiclawsresolu1899nort/publiclawsresolu1899nort_jp2.zip/publiclawsresolu1899nort_jp2%2Fpubliclawsresolu1899nort_0103.jp2&ext=jpg,https://archive.org/download/publiclawsresolu1899nort/publiclawsresolu1899nort.pdf#page=0103
CHAPTER 9.0,10,Sec. 3.,4,"Sec. 3 The said commissioners shall elect the pilots for said in- let and harbor, and may make such rules and regulations for their government as said commissioners may deem right and proper, not inconsistent with the constitution and laws of this state or of the United States.",https://archive.org/download/publiclawsresolu1899nort/publiclawsresolu1899nort_jp2.zip/publiclawsresolu1899nort_jp2%2Fpubliclawsresolu1899nort_0103.jp2&ext=jpg,https://archive.org/download/publiclawsresolu1899nort/publiclawsresolu1899nort.pdf#page=0103
CHAPTER 9.0,10,See. 4.,5,"See. 4 Application for pilot licenses or branches shall be made to said commissioners in writing, giving the name, age and occu- pation of applicants for two years next preceding the date of ap- plication. Every pilot elected by said commissioners shall, before entering upon the discharge of his duties, enter into bond pay- able to the state of North Carolina for the faithful discharge af |his duties in the penal sum of five hundred dollars with two or more sureties, to be approved by said commissioners, and shall also take the oath required by law.",https://archive.org/download/publiclawsresolu1899nort/publiclawsresolu1899nort_jp2.zip/publiclawsresolu1899nort_jp2%2Fpubliclawsresolu1899nort_0103.jp2&ext=jpg,https://archive.org/download/publiclawsresolu1899nort/publiclawsresolu1899nort.pdf#page=0103
CHAPTER 9.0,10,Sec. 5.,6,"Sec. 5 The commissioners aforesaid shall examine all appli- |eants for pilots licenses, and may also examine other persons as to qualification of applicants to perform the duties of pilot, and May in their discretion reject any applicant who they may deem incompetent.",https://archive.org/download/publiclawsresolu1899nort/publiclawsresolu1899nort_jp2.zip/publiclawsresolu1899nort_jp2%2Fpubliclawsresolu1899nort_0103.jp2&ext=jpg,https://archive.org/download/publiclawsresolu1899nort/publiclawsresolu1899nort.pdf#page=0103
CHAPTER 9.0,10,See. 6.,7,"See. 6 The said commissioners shall give to every pilot elected by them, or a majority of them, a license or branch under their hands and seals, which shall be and remain in force for one year, sunless for good cause to said commissioners appearing, the same shall be sooner revoked by them. They shall charge for each li- cense or branch five dollars, which they may retain for their ex- penses and services.",https://archive.org/download/publiclawsresolu1899nort/publiclawsresolu1899nort_jp2.zip/publiclawsresolu1899nort_jp2%2Fpubliclawsresolu1899nort_0103.jp2&ext=jpg,https://archive.org/download/publiclawsresolu1899nort/publiclawsresolu1899nort.pdf#page=0103
CHAPTER 9.0,10,SkEc. 7.,8,"SkEc. 7 The pilotage for Old Topsail inlet and Beaufort harbor 3 shall be as is provided in volume two, chapter forty-six, section | thirty-five hundred and thirty-four of the The Code, and the said commissioners shall have the same printed or written on every license or branch issued by them, and every pilot shall exhibit his license to the master of every vessel he has in charge, when demanded by said master.",https://archive.org/download/publiclawsresolu1899nort/publiclawsresolu1899nort_jp2.zip/publiclawsresolu1899nort_jp2%2Fpubliclawsresolu1899nort_0103.jp2&ext=jpg,https://archive.org/download/publiclawsresolu1899nort/publiclawsresolu1899nort.pdf#page=0103
CHAPTER 9.0,10,Suc. 8.,9,Suc. 8 No vessel entering Old Topsail inlet without a pilot shall be required to take one on going to sea; nor shall any vessel be required to take a pilot that has to enter the harbor in dis- tress.,https://archive.org/download/publiclawsresolu1899nort/publiclawsresolu1899nort_jp2.zip/publiclawsresolu1899nort_jp2%2Fpubliclawsresolu1899nort_0104.jp2&ext=jpg,https://archive.org/download/publiclawsresolu1899nort/publiclawsresolu1899nort.pdf#page=0104
CHAPTER 9.0,10,Src. 9.,10,"Src. 9 Chapter one hundred and forty-nine, laws of eighteen hundred and eighty-three, and all laws and clauses of laws in conflict with this act are hereby repealed.",https://archive.org/download/publiclawsresolu1899nort/publiclawsresolu1899nort_jp2.zip/publiclawsresolu1899nort_jp2%2Fpubliclawsresolu1899nort_0104.jp2&ext=jpg,https://archive.org/download/publiclawsresolu1899nort/publiclawsresolu1899nort.pdf#page=0104
CHAPTER 9.0,10,"Src. 10,",11,"Src. 10, This act shall be and remain in force on and after June first, eighteen hundred and ninety-nine. Ratified the 24th day of January, A. D. 1899",https://archive.org/download/publiclawsresolu1899nort/publiclawsresolu1899nort_jp2.zip/publiclawsresolu1899nort_jp2%2Fpubliclawsresolu1899nort_0104.jp2&ext=jpg,https://archive.org/download/publiclawsresolu1899nort/publiclawsresolu1899nort.pdf#page=0104
CHAPTER 10.0,11,Chapter_Title,1,"CHAPTER 10 An act to give consent by the state of North Carolina to the acquirement by the United States, by purchase. or condemnation, of such lands as may be reqnired for the establishment of a fish cultural station in said state. The General Assembly of North Carolina do enact :",https://archive.org/download/publiclawsresolu1899nort/publiclawsresolu1899nort_jp2.zip/publiclawsresolu1899nort_jp2%2Fpubliclawsresolu1899nort_0104.jp2&ext=jpg,https://archive.org/download/publiclawsresolu1899nort/publiclawsresolu1899nort.pdf#page=0104
CHAPTER 10.0,11,SEcTIoN 1.,2,"SEcTIoN 1 Whereas the federal congress has made an appro- priation for the establishment of a fish cultural station within the bounds of North Carolina: Therefore, be it enacted by the general assembly of the state of North Carolina, that the consent, of the legislature of the state of North Carolina be, and is hereby given, to the acquisition by the United States by condemnation or purchase of any land needed for the establishment of a fish cultural station and the erection thereon of such buildings and improvements as may be necessary for the successful operations of such fish cultural station: Provided, that this cession is upon the express condition that the state of North Carolina shall so fax retain a concurrent jurisdiction with the United States over such lands as that all civil and criminal process issued from the courts of the state of North Carolina may be executed thereon in like manner as if this act had not been passed. |",https://archive.org/download/publiclawsresolu1899nort/publiclawsresolu1899nort_jp2.zip/publiclawsresolu1899nort_jp2%2Fpubliclawsresolu1899nort_0104.jp2&ext=jpg,https://archive.org/download/publiclawsresolu1899nort/publiclawsresolu1899nort.pdf#page=0104
CHAPTER 10.0,11,Suc. 2.,3,"Suc. 2 That this act shall be in force from and after its ratifi- cation. F | Ratified the 26th day of January, A. D. 1899 .",https://archive.org/download/publiclawsresolu1899nort/publiclawsresolu1899nort_jp2.zip/publiclawsresolu1899nort_jp2%2Fpubliclawsresolu1899nort_0104.jp2&ext=jpg,https://archive.org/download/publiclawsresolu1899nort/publiclawsresolu1899nort.pdf#page=0104
CHAPTER 11,12,Chapter_Title,1,"CHAPTER 11 An act to raise revenue. The General Assembly of North Carolina do enact: SCHEDULE A. | SECTION [1]. That the taxes hereinafter designated are payable lin existing national currency, and shall be assessed and collected lander the rules and regulations prescribed by law, and applied \to the payment of the expenses of the state government, the ap- propriations to charitable and penal institutions, other specific lappropriations made by law, and the interest on the four per cen- tum consolidated debt of the state. _",https://archive.org/download/publiclawsresolu1899nort/publiclawsresolu1899nort_jp2.zip/publiclawsresolu1899nort_jp2%2Fpubliclawsresolu1899nort_0105.jp2&ext=jpg,https://archive.org/download/publiclawsresolu1899nort/publiclawsresolu1899nort.pdf#page=0105
CHAPTER 11,12,Sec. 2.,2,"Sec. 2 On each taxable poll or male between the ages of ltwenty-one and fifty years, except the poor and infirm, whom the county ecmmissioners may declare and record fit subjects for exemption, there skal! be annually levied and collected a tax.of lone dollar and twenty-nine cents, the proceeds of such tax to-be devoted to the purposes of education and the support of the poor las may be prescribed by law not inconsistent with the appor- itionment established by section two of article five of the consti- tution of the state.",https://archive.org/download/publiclawsresolu1899nort/publiclawsresolu1899nort_jp2.zip/publiclawsresolu1899nort_jp2%2Fpubliclawsresolu1899nort_0105.jp2&ext=jpg,https://archive.org/download/publiclawsresolu1899nort/publiclawsresolu1899nort.pdf#page=0105
CHAPTER 11,12,SEC. 3.,3,"SEC. 3 There shall be levied and collected annually an ad valo- rem tax of twenty-one and two-thirds cents for state purposes, three and one-third cents for pensions, eighteen cents for public schools, making forty-three cents on every one hundred dollars value of real and personal property in this state, and moneys, leredits, surplus reserve funds, undivided profits, deposits of non- residents, investments in bonds, stocks, joint stock companies, or lotherwise, required to be listed in an act to provide for the as- sessment of property and collection of taxes, subject to exemp- tions made by law, and no city or other municipal corporation shall have power to impose, levy or collect any greater sum on real and personal property than one per centum of the value thereof except by special authority from the general assembly..",https://archive.org/download/publiclawsresolu1899nort/publiclawsresolu1899nort_jp2.zip/publiclawsresolu1899nort_jp2%2Fpubliclawsresolu1899nort_0105.jp2&ext=jpg,https://archive.org/download/publiclawsresolu1899nort/publiclawsresolu1899nort.pdf#page=0105
CHAPTER 11,12,Src. 4.,4,"Src. 4 The taxes imposed for state purposes upon the shares of tock in any bank or banking associations, (whether state or na- flonal), in this state. shall be paid by the cashier of such bank or banking association, directly to the state treasurer, within thirty days aiter the first day of July in each year, and upon failure to pay the state treasurer as aforesaid, he shall institute an action against the bank or banking association to enforce the same in the county of Wake, or in the county in which the bank or bank- ing association is located. The board of commissioners of the county in which such banks or banking associations are located shall assess against the value of shares of residents of that county       the tax imposed for school and county purposes, which shall be paid to the sheriff of that county, and the values of shares of © stock in national, state and private banks and banking associa- tions held by non-residents shall not be deducted from the aggre- gate value of the shares thereof: Provided, that, in determining the value of such shares for taxation there shall be deducted the amount of real property upon which the bank has paid the tax: 7] And provided, that such shares shall be deemed soivent credits. 7)",https://archive.org/download/publiclawsresolu1899nort/publiclawsresolu1899nort_jp2.zip/publiclawsresolu1899nort_jp2%2Fpubliclawsresolu1899nort_0105.jp2&ext=jpg,https://archive.org/download/publiclawsresolu1899nort/publiclawsresolu1899nort.pdf#page=0105
CHAPTER 11,12,Src. 5.,5,"Src. 5 That the secretary of each building and loan associa-  | tion organized and conducting business in this state shall list for 7 taxation on the first Monday in June of each year the shares of © stock of such association at their actual value, as shown by the 7 books of said association, He shall deduct from such valuation the shares upon which said association has made loans and which  have been pledged to such association as security therefor. The secretary and treasurer of such association shall pay to the state ~ treasurer by the first day of July of each year the state tax, and 7) to'the sheriff or tax collecior of each county in which such asso- |] ciation is located, the county and school tax on or before Sep- 7 tember the fifteenth of each year. No other tax or assessment )} shall be charged or levied on said association or the shares 7} therein.",https://archive.org/download/publiclawsresolu1899nort/publiclawsresolu1899nort_jp2.zip/publiclawsresolu1899nort_jp2%2Fpubliclawsresolu1899nort_0106.jp2&ext=jpg,https://archive.org/download/publiclawsresolu1899nort/publiclawsresolu1899nort.pdf#page=0106
CHAPTER 11,12,SEC. 6.,6,"SEC. 6 On the gross profits and the income derived from prop- | | from salaries Had fees, public or ances one-half of one per cen-~ tum on the excess over one thousand dollars; on the gross income} derived from other sources, except such as are delivered solely) from property taxed, one-fourth of one per centum on the excess) | over one thousand to five thousand dollars ; one-half of one per centum on the excess over five thousand to ten thousand dollars; | one per centum on the excess over ten thousand to twenty thou? } sand dollars, and two per centum on the excess over twenty thou-9) sand dollars.",https://archive.org/download/publiclawsresolu1899nort/publiclawsresolu1899nort_jp2.zip/publiclawsresolu1899nort_jp2%2Fpubliclawsresolu1899nort_0106.jp2&ext=jpg,https://archive.org/download/publiclawsresolu1899nort/publiclawsresolu1899nort.pdf#page=0106
CHAPTER 11,12,Src. 7.,7,"Src. 7 Whenever in any law or act of incorporation granted either under the general law or by special act, is any limitation® or exemption of taxation, the same is hereby repealed; and all) the property and effects of all such corporations shall be liable toy taxation, except property belonging to the state and municipal || corporations and property held for the benefit of churches, relig oe ious societies, associations or organizations, and property held for ¥ the benefit of charitable, educational, literary or benevolent in- | stitutions or orders, and also cemeteries: Provided, that no prop- erty whatever held or used for investments, speculation or for } rent shall be exempt, any and all investments made by any rail- | road company in the stock, bonds, or other securities of other cor- | porations or loans shail be taxable upon the amount of the actual value of such investments. SCHEDULE B.",https://archive.org/download/publiclawsresolu1899nort/publiclawsresolu1899nort_jp2.zip/publiclawsresolu1899nort_jp2%2Fpubliclawsresolu1899nort_0106.jp2&ext=jpg,https://archive.org/download/publiclawsresolu1899nort/publiclawsresolu1899nort.pdf#page=0106
CHAPTER 11,12,Src. 8.,8,"Src. 8 That taxes in this schedule shall be imposed as license tax for the privilege of carrying on the business or doing the act named, and nothing in the schedule contained shall be construed to relieve any person from the payment of the ad valorem tax on his property as required in the preceding schedule. The license issued under this schedule shall be for twelve months unless otherwise specially provided in any section imposing a tax, and shall expire on the thirty-first day of May of each year: Pro- vided, that persons becoming liable for any license payable to the state treasurer at any time after May thirty-first of any year, shall pay the pro rata part of the year ending May thirty-first of the year, counting from the first day of the month in which said Jicense became due.",https://archive.org/download/publiclawsresolu1899nort/publiclawsresolu1899nort_jp2.zip/publiclawsresolu1899nort_jp2%2Fpubliclawsresolu1899nort_0107.jp2&ext=jpg,https://archive.org/download/publiclawsresolu1899nort/publiclawsresolu1899nort.pdf#page=0107
CHAPTER 11,12,SEC. 9.,9,"SEC. 9 On each room or hall used as a theatre or opera house where public exhibitions or performances are given for profit, in a city or town having more than ten thousand inhabitants, two hundred dollars per annum; less than ten thousand inhabitants and over five thousand, one hundred dollars; unless [less than] five thousand inhabitants and not less than twenty-five hundred, fifty dollars; less than twenty-five hundred inhabitants and over one thousand, twenty-five dollars; less than one thousand inhabi- tants, fifteen dollars. The license under this section shall be is- sued by the sheriff, and said halls shall not be liable to any other Jicensestax by the county, but the said tax shall be divided and one half paid to the state and one-half to the county. Compa- nies or individuals performing or exhibiting in halls licensed in this section shall not be required to pay either county or state tax. :",https://archive.org/download/publiclawsresolu1899nort/publiclawsresolu1899nort_jp2.zip/publiclawsresolu1899nort_jp2%2Fpubliclawsresolu1899nort_0107.jp2&ext=jpg,https://archive.org/download/publiclawsresolu1899nort/publiclawsresolu1899nort.pdf#page=0107
CHAPTER 11,12,Sec. 10.,10,"Sec. 10 On every travelling theatrical company giving exhibi- tions or performances in any hall not licensed as provided in the next preceding section. ten dollars on each exhibition or perform- ance, and the owner of the hall shall be responsible for said tax.",https://archive.org/download/publiclawsresolu1899nort/publiclawsresolu1899nort_jp2.zip/publiclawsresolu1899nort_jp2%2Fpubliclawsresolu1899nort_0107.jp2&ext=jpg,https://archive.org/download/publiclawsresolu1899nort/publiclawsresolu1899nort.pdf#page=0107
CHAPTER 11,12,Sc. 11.,11,"Sc. 11 On each concert or musical entertainment for profit, not given in a hall licensed as provided in section eight of this act, unless the same be given for the sole benefit of religious, charitable or educational purposes, three dollars, and the owner of the hall or house in which the entertainment was held shall be responsible for said tax. '",https://archive.org/download/publiclawsresolu1899nort/publiclawsresolu1899nort_jp2.zip/publiclawsresolu1899nort_jp2%2Fpubliclawsresolu1899nort_0107.jp2&ext=jpg,https://archive.org/download/publiclawsresolu1899nort/publiclawsresolu1899nort.pdf#page=0107
CHAPTER 11,12,SEc. 12.,12,"SEc. 12 On each lecture for rewards, three dollars, unless the same be given for the sole benefit of religious, charitable or edu- cational purposes, or in a licensed hall, and the owner of the hall shall be responsible for said tax.",https://archive.org/download/publiclawsresolu1899nort/publiclawsresolu1899nort_jp2.zip/publiclawsresolu1899nort_jp2%2Fpubliclawsresolu1899nort_0107.jp2&ext=jpg,https://archive.org/download/publiclawsresolu1899nort/publiclawsresolu1899nort.pdf#page=0107
CHAPTER 11,12,Sec. 13.,13,"Src. 18 On museums, waxworks or curiosities of any kind, natural or artificial, on each days or nights exhibition, three dollars, unless given for the sole benefit of religious, charitable or educational purposes, and the owner of the hall shall be respon- sible for said tax.",https://archive.org/download/publiclawsresolu1899nort/publiclawsresolu1899nort_jp2.zip/publiclawsresolu1899nort_jp2%2Fpubliclawsresolu1899nort_0108.jp2&ext=jpg,https://archive.org/download/publiclawsresolu1899nort/publiclawsresolu1899nort.pdf#page=0108
CHAPTER 11,12,Src. 14.,14,"Src. 14 On every exhibition of a circus or menagerie, for each day or part of a day, two hundred dollars, and each side show fifty dollars, and on every show given under canvas or othérwise, in which animals are exhibited and trapeze and juggling perform- ances are given, for each day or part of a day, fifty dollars, whether free or otherwise, and the county shall levy the same amount and no more.",https://archive.org/download/publiclawsresolu1899nort/publiclawsresolu1899nort_jp2.zip/publiclawsresolu1899nort_jp2%2Fpubliclawsresolu1899nort_0108.jp2&ext=jpg,https://archive.org/download/publiclawsresolu1899nort/publiclawsresolu1899nort.pdf#page=0108
CHAPTER 11,12,Sc. 15.,15,"Sc. 15 On all companies or persons whatever who exhibit or give entertainment for amusement of the public, for reward or otherwise than is mentioned in the five preceding sections, five dollars for each exhibition or performance. Exhibitions or entertainments given for the sole benefit of religious, chari- table or educational objects [shall] be exempt from taxation: Provided, no part or clause of this section shall be so construed as to exempt from taxation persons claiming to be spiritualists or mediums of communications between the material and imma- terial worlds and giving public exhibitions; Provided, this sec- tion shall not apply to stationary bird shows.",https://archive.org/download/publiclawsresolu1899nort/publiclawsresolu1899nort_jp2.zip/publiclawsresolu1899nort_jp2%2Fpubliclawsresolu1899nort_0108.jp2&ext=jpg,https://archive.org/download/publiclawsresolu1899nort/publiclawsresolu1899nort.pdf#page=0108
