chapter,chapter_index,section,section_index,text,first_jpg_url,pdf_url
CHAPTER 15.0,16,Skc. 104.,103,"Skc. 104 The sheriff or other accounting officer shall, on or be- fore the second Monday in January in each year, settle his state tax account with the commissioners of his county and pay the amount for which said sheriff or collector is liable to the treas- urer of the state, in such a manner or at such place as he shall direct. provided the state treasurer may extend the time ona sufficient amount to cover the state tax on the Jand sales in each county to first Monday in May. The commissioners shall forth- with report to the state auditor the amount due from such ace- counting officer, setting forth therein the net amount due to each fund, and the treasurer, upon a statement from the auditor, shall open an account against such officer and debit him accordingly. The sheriff or tax collector, in making his settlements as afore- said, shall file with the commissioners a duplicate of the list re- quired in section one hundred and four of this act. In such set- tlement the sheriff or other officers shall be charged with the amount of public tax. as the same appears by the abstract of the taxables transmitted to the auditor; also with all double tax and taxes on unlisted property by him received and with other tax which he may have collected or for which he is chargeable. The auditor shall give to each sheriff or tax collector a certified state- ment embracing the subjects of taxation contained in both lists and the amount of tax on each subject, which the sheriff or tax collector shall deposit with the clerk of the commissioners of his county for public inspection.",https://archive.org/download/publiclawsresolu1899nort/publiclawsresolu1899nort_jp2.zip/publiclawsresolu1899nort_jp2%2Fpubliclawsresolu1899nort_0172.jp2&ext=jpg,https://archive.org/download/publiclawsresolu1899nort/publiclawsresolu1899nort.pdf#page=0172
CHAPTER 15.0,16,Skc. 105.,104,"Skc. 105 The auditor in making the settlement of the amount due from the sheriff or tax collector aforesaid, shall deduct from the list return: -1 Taxes on personal property certified by the clerk of the com- missioners of the county, by order of the commissioners, to be in- solvent and uncolléctible. -2 All over-payments made in former settlements by reason of any error in the clerks abstract of taxables. -8 Five per centum of commission on the amount collected.",https://archive.org/download/publiclawsresolu1899nort/publiclawsresolu1899nort_jp2.zip/publiclawsresolu1899nort_jp2%2Fpubliclawsresolu1899nort_0172.jp2&ext=jpg,https://archive.org/download/publiclawsresolu1899nort/publiclawsresolu1899nort.pdf#page=0172
CHAPTER 15.0,16,SEc. 106.,105,"SEc. 106 For his settlement with the state treasurer the sheriff or tax collector shall be paid three dollars for each day he may be actually and necessarily engaged therein with the commis: sioners at the county seat, and ten cents per mile, by usual route of travel, for twice the distance between the court-house and the place designated by the state treasurer, to be paid by him on the warrant of the auditor upon certificate of the sheriff or tax collec- tor duly verified before the board of commissioners.",https://archive.org/download/publiclawsresolu1899nort/publiclawsresolu1899nort_jp2.zip/publiclawsresolu1899nort_jp2%2Fpubliclawsresolu1899nort_0172.jp2&ext=jpg,https://archive.org/download/publiclawsresolu1899nort/publiclawsresolu1899nort.pdf#page=0172
CHAPTER 15.0,16,Sxc. 107..,106,"Sxc. 107.. In every case of failure by the sheriff or other ac- counting officer to settie his account within the time prescribed by this act for such settlements, and to take oath required in his settlement and pay the amount due to the treasurer, the auditor shall forthwith report te the treasurer the account of such sheriff or officer, deducting therefrom nothing for commissions or insol- vents, but adding thereto one thousand do:lars and ten per cen- tum of the amount of taxes with which said sheriff is charged for the amount of taxes supposed not to appear in the list transmit- ted by the clerk, and furnish him with a copy of the official bond of said officer and his sureties; and if the whole amount be not paid the treasurer, on motion of the solicitor of the fourth judi- cial district, in the superior court of Wake county, before the clerk thereof, within twenty days after default shal! have oe- eurred, shall recover judgment against him and his sureties with- out other notice than is given by the delinquency of the officio. And to the end that the obligations and names may be known the clerk of the superior court shall, on or before the second Mon- day in October in each year, transmit to the auditor a copy cer- tified under seal of the court. of the bond of the sheriff and his sureties, upon pain for his default of forfeiting to the state one thousand dollars, which the auditor shall, and is hereby specially charged to collect in like manner and at such times asis provided in this section. If the sheriff or other accounting officers shall fraudulently and corruptly fail to account as aforesaid, or shall fraudulently make any deed to the contrary under section eighty- seven (eighty: five) of this act, he shall be deemed guilty of a mis- demeanor. and upon conviction thereof in any court of comper tent jurisdiction, shall be sentenced to pay a fine, in the discre- tion of the court, and be imprisoned not less than three nor more than twelve months.",https://archive.org/download/publiclawsresolu1899nort/publiclawsresolu1899nort_jp2.zip/publiclawsresolu1899nort_jp2%2Fpubliclawsresolu1899nort_0172.jp2&ext=jpg,https://archive.org/download/publiclawsresolu1899nort/publiclawsresolu1899nort.pdf#page=0172
CHAPTER 15.0,16,Skc. 108.,107,"Skc. 108 The sheriff or the tax ccllector shall pay the county taxes to the county treasurer or other lawtul officer. He shall at no time retain in hand over three hundred dollars for a longer time than ten days, under a penalty of two per centum per month to the county upon all sums so unlawfully retained, and shall, on oath, render a statement to the commissioners at their monthly meeting of the amount in his hands. On or before the first Mon- day of February in each year the sheriff shall account with the county treasurer or other lawful officer for all taxes due the county for the fiscal year, and on failing to do so, he shall pay the county treasurer a penalty of two per centum per month on allsums unpaid, ard this shall be continued until final settle- ment: Provided, the board of county commissioners may, in their discretion, relieve the sheriff or tax collector of said penalty of two per centum per month upon payment in full of the county taxes: Provided, the county commissioners may extend the time of settlement of the sherifl' of the county taxes to the first Mon- day in May.",https://archive.org/download/publiclawsresolu1899nort/publiclawsresolu1899nort_jp2.zip/publiclawsresolu1899nort_jp2%2Fpubliclawsresolu1899nort_0173.jp2&ext=jpg,https://archive.org/download/publiclawsresolu1899nort/publiclawsresolu1899nort.pdf#page=0173
CHAPTER 15.0,16,Sc. 109.,108,"Sc. 109 The treasurer of the state with the advice and appro- val of the attorney-general, is hereby authorized, when in the judgment of these officers it may be best to secure the interest of the state, and will not lose any lien held by the state. to grant indulgence to defendants in execution and relinquish penalties upon payment of amount of dues owing to the state; and like- wise to bid for, in behalf of the state, and purchase property of said defendants when deemed necessary to secure the payment of the dues.",https://archive.org/download/publiclawsresolu1899nort/publiclawsresolu1899nort_jp2.zip/publiclawsresolu1899nort_jp2%2Fpubliclawsresolu1899nort_0173.jp2&ext=jpg,https://archive.org/download/publiclawsresolu1899nort/publiclawsresolu1899nort.pdf#page=0173
CHAPTER 15.0,16,Sec. 110.,109,"Sec. 110 The sheriff or tax collector shall be charged with the sums appearing by the tax lists as due for the county taxes. and shall be allowed to deduct therefrom, in like manner as is pre- seribed in this act in regard to Ffis settlement of state taxes, all insolvents and uncollectible poll taxes, and also the amount of county tax on the lands bid off by the county, and costs and fees, which shall be: For making a deed. fifty cents; for registering, twenty-five cents; and such other necessary sums as were actu- ally paid by the sheriff: Provided, a majority of any board of county commissioners may extend the time for the collection © and settlement of the county taxes in the respective counties to such time as they may deem expedient, not to extend beyond the first of May in the year following in which taxes were levied: Provided, that it shall be unlawful for any sheriff or tax co!lec- tor, in accounting with the board of county commissioners for either the state or county taxes, to exhibit or present in said county any money not actually derived from the collection of taxes; and any such sheriff or tax collector so offending shall forfeit a penalty of five hundred dollars, one half of which shall belong to any person who shall sue for the same, and the other half to the county in which the sheriff resides: Provided further, that any sheriff, tax collector or county treasurer who shall use any part of the county or state taxes otherwise than is directed by law, shall forfeit double the amount of his commissions on the county and state taxes for the year in which he so misused said taxes, one-half to belong to any person suing for the same, and the other half to the county in which said sheriff resides.",https://archive.org/download/publiclawsresolu1899nort/publiclawsresolu1899nort_jp2.zip/publiclawsresolu1899nort_jp2%2Fpubliclawsresolu1899nort_0174.jp2&ext=jpg,https://archive.org/download/publiclawsresolu1899nort/publiclawsresolu1899nort.pdf#page=0174
CHAPTER 15.0,16,Skc. 111.,110,"Skc. 111 The board of county commissioners, at their last regular snbsequent meeting in each year, shall appoint one or more of their number, not to exceed three, to be present at the accounting.and settlements between the sheriff and county treasurer. provided for in the next preceding section; and also to audit and settle ac- counts of the county treasurer and of all other county officers au- thorized to receive or disburse county funds. The account so audited shall be-reported to the board of commissioners, and when approved by them shall be filed with the clerk and recorded on his book, and sha'l be prima facie evidence of their correct- ness, and impeachable only for fraud or special error: Provided, the compensation allowed such committee for their services shall , not exceed two dollars per day each for the time actually spent in said settlements, and there shall be no allowance for extra clerical aid. ;",https://archive.org/download/publiclawsresolu1899nort/publiclawsresolu1899nort_jp2.zip/publiclawsresolu1899nort_jp2%2Fpubliclawsresolu1899nort_0174.jp2&ext=jpg,https://archive.org/download/publiclawsresolu1899nort/publiclawsresolu1899nort.pdf#page=0174
CHAPTER 15.0,16,Sec. 112.,111,"Sec. 112 In ease the sheriff of a county shall fail, neglect or refuse to account with the county treasurer and assistant commit- tee as above required. or to pay what may be rightfully found due in such accounts, he shall forfeit and pay to the state, for the use of the county, a penalty of twenty-five hundred doilars. It shall be the duty of the county treasurer, and if he neglect or refuse to-perform it, the chairman of the board of commissioners, to cause an action to be brought in#he superior court of the county on the bond of the sheriff, against him and his sureties, to recover the amount owing by him and the penalty aforesaid; if the sheriff shall fraudulently and corruptly fail to account as aforesaid, he shall be criminaliy liable thereupon in like manner and with same penalties imposed for such criminal defaleation in section one hundred and eight of this act.",https://archive.org/download/publiclawsresolu1899nort/publiclawsresolu1899nort_jp2.zip/publiclawsresolu1899nort_jp2%2Fpubliclawsresolu1899nort_0175.jp2&ext=jpg,https://archive.org/download/publiclawsresolu1899nort/publiclawsresolu1899nort.pdf#page=0175
CHAPTER 15.0,16,SEc. 113.,112,"SEc. 113 In each year the county treasurer shall give five days notice to all the county officers (except the sheriff), authorized to receive or disburse the county funds, to appear at the court-house on a certain day in January, before him and the committee ap- pointed by the board of commissioners, and present an account of all sums received or disbursed for the county, with their vouchers; and any officer failing to attend and account shall be deemed guilty of a misdemeanor. The accounts, when audited, shall be reported tothe board of. commissioners at their next meeting, and, if approved, shall be filed with the clerk and re- eorded in their proceedings, together with their approval, and shall be deemed prima facie correct.",https://archive.org/download/publiclawsresolu1899nort/publiclawsresolu1899nort_jp2.zip/publiclawsresolu1899nort_jp2%2Fpubliclawsresolu1899nort_0175.jp2&ext=jpg,https://archive.org/download/publiclawsresolu1899nort/publiclawsresolu1899nort.pdf#page=0175
CHAPTER 15.0,16,Src. 114.,113,"Src. 114 Whenever in this acta duty is imposed upon a sheriff of a county of which a tax collector has been or may be ap- pointed, it shall be incumbent upon the tax collector to perform the said office instead of the sheriff, and such tax collector shall collect all the taxes, have all emoluments and be subject to all the penalties as provided in case of sheriffs in this act; and it shall be the duty of all persons having tax moneys in hand tc account for and settle with said tax collector.",https://archive.org/download/publiclawsresolu1899nort/publiclawsresolu1899nort_jp2.zip/publiclawsresolu1899nort_jp2%2Fpubliclawsresolu1899nort_0175.jp2&ext=jpg,https://archive.org/download/publiclawsresolu1899nort/publiclawsresolu1899nort.pdf#page=0175
CHAPTER 15.0,16,SEc. 115.,114,"SEc. 115 If any sheriff shall die during the time appointed for collecting the taxes, his sureties may collect them, and for that purpose shall have all power and means for collecting the same from the collectors and taxpayers as the sheriff would have had, and shall be subject to all the remedies for collecting and settle ment of the taxes on their bond or otherwise as might have been had against the sheriff if he had lived.",https://archive.org/download/publiclawsresolu1899nort/publiclawsresolu1899nort_jp2.zip/publiclawsresolu1899nort_jp2%2Fpubliclawsresolu1899nort_0175.jp2&ext=jpg,https://archive.org/download/publiclawsresolu1899nort/publiclawsresolu1899nort.pdf#page=0175
CHAPTER 15.0,16,SEc. 116.,115,SEc. 116 The sheriff (and in case of his death the sureties) shall have one year and no longer from the day prescribed for his set- tlement and payment of the state taxes to finish the collection of all taxes; but the extension of time for collection shall not ex- tend the time of his settlement of the taxes. imal,https://archive.org/download/publiclawsresolu1899nort/publiclawsresolu1899nort_jp2.zip/publiclawsresolu1899nort_jp2%2Fpubliclawsresolu1899nort_0175.jp2&ext=jpg,https://archive.org/download/publiclawsresolu1899nort/publiclawsresolu1899nort.pdf#page=0175
CHAPTER 15.0,16,Sec. 117.,116,"Sec. 117 The secretary of state shall have printed five thou- sand copies of an act to raise revenue and an act to .provide for the assessment of property and the collection of taxes, and distribute the said acts among the officers, whose duty it is'to ex- ecute or carry into effect any portion thereof.",https://archive.org/download/publiclawsresolu1899nort/publiclawsresolu1899nort_jp2.zip/publiclawsresolu1899nort_jp2%2Fpubliclawsresolu1899nort_0176.jp2&ext=jpg,https://archive.org/download/publiclawsresolu1899nort/publiclawsresolu1899nort.pdf#page=0176
CHAPTER 15.0,16,Src. 118.,117,"Src. 118 The secretary. of state shall, in like manner, hee printed five copies of said acts for each member of the general assembly, and forward the same [to] them by mail. 7",https://archive.org/download/publiclawsresolu1899nort/publiclawsresolu1899nort_jp2.zip/publiclawsresolu1899nort_jp2%2Fpubliclawsresolu1899nort_0176.jp2&ext=jpg,https://archive.org/download/publiclawsresolu1899nort/publiclawsresolu1899nort.pdf#page=0176
CHAPTER 15.0,16,SEc. 119,118,"SEc. 119 The state auditor shall prepare and furnish to the board of commissioners of each county a sufficient number of blank forms or lists, with the proper oath added thereto, on which each taxpayer in the state shall make out under oath a TRUE state- ment and return of all his property, with the value thereof, ac- cording to the provisions of this act.",https://archive.org/download/publiclawsresolu1899nort/publiclawsresolu1899nort_jp2.zip/publiclawsresolu1899nort_jp2%2Fpubliclawsresolu1899nort_0176.jp2&ext=jpg,https://archive.org/download/publiclawsresolu1899nort/publiclawsresolu1899nort.pdf#page=0176
CHAPTER 15.0,16,SEc. 120.,119,"SEc. 120 All acts and parts of acts inconsistent with the pro- visions of this act are hereby repealed: Provided, that such re- peal shall notin any manner affect any rights heretofore acquired, or the collection of any taxes heretofore levied or assessed, or the validity of any sales for taxes heretofore made, or any right here- tofore acquired under any law of this state.",https://archive.org/download/publiclawsresolu1899nort/publiclawsresolu1899nort_jp2.zip/publiclawsresolu1899nort_jp2%2Fpubliclawsresolu1899nort_0176.jp2&ext=jpg,https://archive.org/download/publiclawsresolu1899nort/publiclawsresolu1899nort.pdf#page=0176
CHAPTER 15.0,16,Sec. 121.,120,"Sec. 121 That this act shall be in force from and after its rati- fication. Ratified the 8th day of March, 1897",https://archive.org/download/publiclawsresolu1899nort/publiclawsresolu1899nort_jp2.zip/publiclawsresolu1899nort_jp2%2Fpubliclawsresolu1899nort_0176.jp2&ext=jpg,https://archive.org/download/publiclawsresolu1899nort/publiclawsresolu1899nort.pdf#page=0176
CHAPTER 16.0,17,Chapter_Title,1,"CHAPTER 16 An act to repeal chapter one hundred and fifty-nine of the public laws of eighteen hundred and ninety-five, and chapter one hundred and eighty- five of the public laws of eighteen hundred [and] ninety-seven. The General Assembly of North Carolina do enact :",https://archive.org/download/publiclawsresolu1899nort/publiclawsresolu1899nort_jp2.zip/publiclawsresolu1899nort_jp2%2Fpubliclawsresolu1899nort_0176.jp2&ext=jpg,https://archive.org/download/publiclawsresolu1899nort/publiclawsresolu1899nort.pdf#page=0176
CHAPTER 16.0,17,SEcTION 1.,2,"SEcTION 1 That chapter one hundred and fifty-nine of the public laws of eighteen hundred and ninety-five, entitled An act to revise, amend and consolidate the election laws of North Carolina, and chapter one hundred and eighty-five of the pub- lic laws of eighteen hundred:and ninety-seven, entitled An act to amend the election law of North Carolina, be and the same are hereby repealed.",https://archive.org/download/publiclawsresolu1899nort/publiclawsresolu1899nort_jp2.zip/publiclawsresolu1899nort_jp2%2Fpubliclawsresolu1899nort_0176.jp2&ext=jpg,https://archive.org/download/publiclawsresolu1899nort/publiclawsresolu1899nort.pdf#page=0176
CHAPTER 16.0,17,Src. 2.,3,"Src. 2 That this act sha'l be in foree from and after its ratifi- eation. Ratified the 26th day of January, A. D. 1899",https://archive.org/download/publiclawsresolu1899nort/publiclawsresolu1899nort_jp2.zip/publiclawsresolu1899nort_jp2%2Fpubliclawsresolu1899nort_0176.jp2&ext=jpg,https://archive.org/download/publiclawsresolu1899nort/publiclawsresolu1899nort.pdf#page=0176
CHAPTER 17.0,18,Chapter_Title,1,"CHAPTER 17 An act to provide a short form for agricultural liens and chattel mort- gages, and to prescribe the fees for probating and registering the same. The General Assembly of North Carolina do enact:",https://archive.org/download/publiclawsresolu1899nort/publiclawsresolu1899nort_jp2.zip/publiclawsresolu1899nort_jp2%2Fpubliclawsresolu1899nort_0177.jp2&ext=jpg,https://archive.org/download/publiclawsresolu1899nort/publiclawsresolu1899nort.pdf#page=0177
CHAPTER 17.0,18,Section 1.,2,"Section 1 That for the purpose of creatingja valid agricultural lien under section seventeen hundred{and ninety-nine of The Code, and amendments thereto, for supplies to be advanced, and also to constitute a valid chattel mortgage as additional security thereto, and to secure a preexisting debt, the following form shall be deemed sufficient, and for those purposes legally effective: State of North Carolina___--__-_- county. SEcTIoN 1 Whereas I, __-_-_---.-, am engaged in cultivating the soil, and ------ ha___- this day agreed to make advances to me of supplies, to the value of _________--- dollars, and such further sums as said _-___. ________ may deem necessary, not to exceed in alls 22 Ee dollars, during the year 18__, to enable me to make acrop during the said year on land in said state and county, PENS Si eed Sh! township, adjoining the lands of __--------------~-, and being the same -___-__-_-: Now, therefore, in consideration of the premises, I do covenant with -____- Eee that I will prop- erly cultivate and harvest on said lands __ acres in cotton, __ acres in corn, __ acres in tobacco, and __ acres in __, that there is no lien on said crop, and to secure payment of the amount advanced to me, I do hereby give-_..___ .--__- a lien, as provided in section seventeen hundred and ninety-nine of The Code of North Caro- lina, on all the crops which may be raised on said land during the year 18__.. Andif by _.________, 18__, I fail to pay the amount advanced, and also fail to deliver to _____.-_-_-__- all said crops at ____place of business, __-_-----___ may close this lien as pro- vided in section eighteen hundred of The Code, or otherwise, and receive from the proceeds the amount due for advances, together with all costs, and expenses of closing the same, and thesurplus, in [if] any, pay to #NAME?",https://archive.org/download/publiclawsresolu1899nort/publiclawsresolu1899nort_jp2.zip/publiclawsresolu1899nort_jp2%2Fpubliclawsresolu1899nort_0177.jp2&ext=jpg,https://archive.org/download/publiclawsresolu1899nort/publiclawsresolu1899nort.pdf#page=0177
CHAPTER 17.0,18,SkEc. 2.,3,"SkEc. 2 And to further secure payment of the amount that may be advaneed, and also the sum of ______ dollars, now due ___-__- by note, dated --, 18__, with interest from _____- . Leconvey to -__--_- all the above crops, and also the following articles of personal prop- CLbYers 22 eee all of which is my own and free from encumbrance, and if by ----- , 18_-__, I fail to pay the amount due them, -_-_--- may sell the property conveyed in this section, as provided by law for sale under chattel mortgages. and from the proceeds re- tain all amounts provided for in section one. Witness my hand and seal, this _-__ day of __.__-, 1802-2 PACS Stumm Oe ees. ne) UM hubiN otis Te [Seal.] wae - = 5        instrument do .... hereby agree with the said -+===-----, incon sideration of the advances to be- made to.....____ by .---- 4 that the above given lien shall have priority to the extent of 1 a advances made by ___----__- to -.---.-_-_, during the year 18____ over any lien to which I may be entitled upon the crop to be ad by him on said lands during said year,  Witness: Sil oo Ape ey Jeno). AO ae 1 a State of North Carolina--_-_. #NAME? ~ Baek 16:00 si The due execution of the foregoing lien was this day prove 2a, before me by the oath and examination of _____________-____=-_.)) subscribing witness thereto eaeaca Wee ote ae es ., [Seal.] Justice of the Peace State of North Carolina__________ county. The foregoing certificate of ____________ a justice of the peace Ole es sae county. is adjudged to be correct. Let the lien with the certificate, be registered, this .___ _ day of ____-_-_-- 18____ Clerk of the Superior Court. State of North Carolina_____- _._- county SATE DCT aes 18____ The due execution of the foregoing conveyance was this day proven before me by the oath and examination of _____. ____ Ae the subscribing witness thereto. Let the same with this certifi- cate be registered. : } Clerk of the Superior Court. Filed for registration at __ oclock, -2 m _--_-_-- 18__, and registered at -- oclock #NAME? m___------- 18 __. WES Register of Deeds.",https://archive.org/download/publiclawsresolu1899nort/publiclawsresolu1899nort_jp2.zip/publiclawsresolu1899nort_jp2%2Fpubliclawsresolu1899nort_0177.jp2&ext=jpg,https://archive.org/download/publiclawsresolu1899nort/publiclawsresolu1899nort.pdf#page=0177
CHAPTER 17.0,18,Sec. 2.,4,"Sec. 2 That the fees for the probate and. registration of liens executed according to the forms set out. above, shall be as fol: lows: To the clerk for probating ten -10 cents, and to the reg- ister of deeds for registering the instrument together with the probate and all necessary acknowledgments and certificates, thirty -80 cents->The fees shall be the same whether said in- strument conveys a lien on crops alone, ora lien on crops and a conveyance of chattels also; Provided, the above fees shall not apply to other forms of lien or mortgage. :",https://archive.org/download/publiclawsresolu1899nort/publiclawsresolu1899nort_jp2.zip/publiclawsresolu1899nort_jp2%2Fpubliclawsresolu1899nort_0178.jp2&ext=jpg,https://archive.org/download/publiclawsresolu1899nort/publiclawsresolu1899nort.pdf#page=0178
